title,link,description
The 18+ best lead generation software and tools in 2025,https://zapier.com/blog/lead-generation-tools/,"A collection of tools to help you generate leads through a variety of mediums: ads, landing pages, chatbots, webinars, and so much more."
Top 22 lead generation software and tools,https://www.zendesk.com/sell/features/lead-generation-software/,"13 thg 3, 2025 — The 22 best B2B lead generation software solutions · 1. Pipedrive · 2. HubSpot Marketing Hub · 3. Agile CRM · 4. CallPage · 5. AeroLeads · 6."
Free Lead Generator Tool for Small & Medium Business,https://www.convergehub.com/lead-generator-free-tool,"ConvergeHub Lead Generator helps you instantly capture qualified leads. #1 Capture Leads from Social Media, Websites, and Email."
Leadfeeder: B2B Lead Generation Software,https://www.leadfeeder.com/,"Identify the B2B companies visiting your website, see how they found you and convert them into high-value leads. Sign up for a free 14-day trial."
Sales Lead | Lead Generation Tools,https://www.pipedrive.com/en/blog/sales-lead-generation,"In this guide to sales lead generation and the best lead generation tools, we'll show you how to find warm leads and nurture them through the sales funnel."
Top 11 AI Tools for Lead Generation,https://www.upwork.com/resources/ai-tools-lead-generation,"15 thg 5, 2025 — Top 11 AI Tools for Lead Generation · 1. Breeze AI · 2. Customers.ai · 3. Albert · 4. Seamless.AI · 5. LeadIQ · 6. Outreach · 7. CoPilot AI · 8."
B2B Lead Generation Software: 30 Best Paid and Free Tools,https://www.cognism.com/blog/lead-generation-tools,"18 thg 3, 2025 — Best B2B lead generation tools: 1. Cognism 2. Kaspr 3. OptinMonster 4. HubSpot 5. Drift 6. Unbounce 7. Outreach 8. Mailchimp 9. Salesforce 10. Zendesk Sell"
FindThatLead - B2B Lead Generation Done in seconds,https://findthatlead.com/en/,The Smartest B2B Sales Prospecting Tool for your Business · 1. Find and extract leads · 2. Send Campaigns · 3. Close Deals.
Lead Generation Software Guide,https://www.salesforce.com/ap/marketing/lead-generation-guide/software/,Lead generation tools provide sales lead automation by incorporating only the most useful and insightful information for salespeople.
